title,event_type,start_at,end_at,location,speaker,sponsor,details,group
Story Hour in the Library featuring Walter Kirn,Reading - Literary,2014-03-13T17:00:00,2014-03-13T18:00:00,"Doe Library, Morrison Library",Walter Kirn,Library,"Walter Kirn is the author of My Mother's Bible, Lost in the Meritocracy: The Undereducation of an Overachiever, The Unbinding, Mission to America, Up in the Air, Thumbsucker, She Needed Me, and My Hard Bargain: Stories. The New York Times has commented that No one mines his own life in the service of understanding the American experience better than Walter Kirn. His novels Thumbsucker and Up in the Air were made into movies. A contributing editor to Time magazine, Kirns work has appeared in the New York Times, GQ, Vogue, New York and Esquire.",Performances
RE@DS: Rebecca Gaydos and Samia Rahimtoola,Reading - Literary,2014-03-14T17:30:00,2014-03-14T18:30:00,Berkeley Art Museum and Pacific Film Archive,Rebecca Gaydos; Samia Rahimtoola,Berkeley Art Museum and Pacific Film Archive,"Rebecca Gaydos is a Ph.D. candidate in the English department at UC Berkeley. She is currently working on a dissertation examining the relationship between technology and experimental poetry during the 1950s and 1960s and a book of poems tracing questions of race, sexuality and language across Mexico and the U.S. She is from Los Angeles. Samia Rahimtoola is a poet and scholar in the English department at UC Berkeley. Her recent work engages movement, both physical and affective, in contemporary American life. Her writing has appeared in Fou and Hubbub. Followed by L@TE: Joan LaBarbara at 7:30 p.m. Admission to RE@DS is included with L@TE admission.",Performances
RE@DS: Rebecca Gaydos and Samia Rahimtoola: The Reading Room,Reading - Literary,2014-03-14T17:30:00,2014-03-14T18:30:00,Berkeley Art Museum and Pacific Film Archive,Rebecca Gaydos; Samia Rahimtoola,Berkeley Art Museum and Pacific Film Archive,"Rebecca Gaydos is a Ph.D. candidate in the English department at UC Berkeley. She is currently working on a dissertation examining the relationship between technology and experimental poetry during the 1950s and 1960s and a book of poems tracing questions of race, sexuality and language across Mexico and the U.S. She is from Los Angeles. Samia Rahimtoola is a poet and scholar in the English department at UC Berkeley. Her recent work engages movement, both physical and affective, in contemporary American life. Her writing has appeared in Fou and Hubbub. Included with L@TE admission",Performances
RE@DS: Rebecca Gaydos and Samia Rahimtoola: The Reading Room,Reading - Literary,2014-03-14T17:30:00,2014-03-14T18:30:00,Berkeley Art Museum and Pacific Film Archive,Rebecca Gaydos; Samia Rahimtoola,Berkeley Art Museum and Pacific Film Archive,"Rebecca Gaydos is a Ph.D. candidate in the English department at UC Berkeley. She is currently working on a dissertation examining the relationship between technology and experimental poetry during the 1950s and 1960s and a book of poems tracing questions of race, sexuality and language across Mexico and the U.S. She is from Los Angeles. Samia Rahimtoola is a poet and scholar in the English department at UC Berkeley. Her recent work engages movement, both physical and affective, in contemporary American life. Her writing has appeared in Fou and Hubbub. Included with L@TE admission",Performances
Joan La Barbara: L@TE: Friday Nights at BAM/PFA,Performing Arts - Music,2014-03-14T19:30:00,2014-03-14T21:00:00,Berkeley Art Museum and Pacific Film Archive,Joan La Barbara,Berkeley Art Museum and Pacific Film Archive,"Joan La Barbara recreates Voice Piece for this special L@TE event, as part of a rare program of her innovative and beautiful vocal compositions. She also sings her recent work ""Solitary Journeys of the Mind"" (2011), a real-time exploration of the art of composition, and ""Windows"" (2013), inspired by the dreams and visions of Joseph Cornell.",Performances
Focus on Flamenco: Estrella Morente,Performing Arts - Music,2014-03-14T20:00:00,2014-03-14T21:00:00,Zellerbach Hall,Cal Performances,,Target audience: All Audiences,Performances
"UC Berkeley Symphony Orchestra: Gershwin, Shostakovich, Ortiz",Performing Arts - Music,2014-03-14T20:00:00,2014-03-14T22:00:00,Hertz Concert Hall,,,Sponsor: Department of Music,Performances
"UC Berkeley Symphony Orchestra: Gershwin, Shostakovich, Ortiz",Performing Arts - Music,2014-03-15T20:00:00,2014-03-15T22:00:00,Hertz Concert Hall,,,Sponsor: Department of Music,Performances
Jerusalem Quartet,Performing Arts - Music,2014-03-16T15:00:00,2014-03-16T16:00:00,Hertz Concert Hall,Cal Performances,"these are the trademarks of this excellent Israeli string quartet,"" says The Times, London. With celebrated recordings and acclaimed international performances, the Jerusalem Quartet has charted a captivating path through some of the most vigorous and compelling repertoire ever written for string quartet. Here, the Jerusalem performs an all-Shostakovich... More >",Target audience: All Audiences,Performances
Music Studies Colloquium - Gjerdingen: The Institutionalization of Apprenticeship in the Great Conservatories: A Cognitive Interpretation of a Non-Verbal Praxis,Performing Arts - Music,2014-03-17T16:30:00,2014-03-17T18:00:00,128 Morrison Hall,"Robert Gjerdingen, Northwestern University",Department of Music,"Music, like all the other crafts of pre-industrial Europe, was learned through apprenticeship. When formalized, an apprenticeship often involved a ten-year indenture of a young boy or girl to a master or mistress. Unpaid labor was exchanged for entry into the mystery of the craft. The four conservatori or foundling homes of Naples were the first to institutionalize this indenture, ultimately aggregating as many as 600 boys for the intense study of music. Just as the four Inns of Court in London raised clerkship to a higher level in English law, so the conservatories of Naples created a critical mass of young talents such as Europe had never seen. By the end of the nineteenth century almost every industrializing nation had established its own version of a music conservatory. Perhaps the low social status of foundlings and performing musicians and their hermetic insiders praxis (a hold-over from the closed world of craft guilds) led educated writers on music to overlook or to deprecate the mindless repetitive exercises of the conservatories. Even when, at the Paris Conservatory, the work of replicating master patterns was raised to a level of finesse comparable to that of the École des Beaux-Arts, it was still not considered of any theoretical significance. Only from the mid-1990s did a small group of scholars begin to re-examine and rediscover what was being learned in the great conservatories. In modern terms, we can now recognize a systematic praxis aimed at the building up of a huge repertory of schemata or constructions, which collectively operated like what contemporary linguists term a usage-based grammar. The goal of such an undertaking would be to produce native speakers of a language, and the many great composers who emerged from this training would seem to support its efficacy.",Performances
University Baroque Ensemble: 61st Annual Noon Concert,Performing Arts - Music,2014-03-19T12:15:00,2014-03-19T13:00:00,Hertz Concert Hall,Department of Music,,Target audience: All Audiences,Performances
Bloch Professor Georgina Born: Bloch Lecture series: Music and the Digital,Performing Arts - Music,2014-03-21T16:30:00,2014-03-21T18:00:00,"Morrison Hall, 125 Morrison, Elkus Room","Professor Georgina Born, http://www.music.ox.ac.uk/about/people/academic-staff/university-lecturers-and-college-fellows/georgina-born/",Department of Music,"Opening lecture: Directions in Digital Musics, 2/24 at 8pm, Hertz Hall Subsequent lectures are on Fridays at 4:30, in the Elkus Room 125 Morrison Hall March 7, Socialities and Institutions March 21, Aesthetics and Materialities April 18, Times and Genres May 2, Ontologies and Interdisciplinarities Georgina Born is Professor of Music and Anthropology at the University of Oxford.",Performances
Trey McIntyre Project,Performing Arts - Dance,2014-03-21T20:00:00,2014-03-21T21:00:00,Zellerbach Hall,Cal Performances,,Target audience: All Audiences,Performances
Trey McIntyre Project,Performing Arts - Dance,2014-03-22T20:00:00,2014-03-22T21:00:00,Zellerbach Hall,Cal Performances,,Target audience: All Audiences,Performances
Takacs Quartet: Bartok Cycle,Performing Arts - Music,2014-03-22T20:00:00,2014-03-22T21:00:00,Hertz Concert Hall,Cal Performances,"the complete cycle of Bartók string quartets, performed over two consecutive days. Bartók's quartets have been at the very heart of Takács's repertoire since the group was founded in Budapest in 1975, and it was a recording of those works that put... More >",Target audience: All Audiences,Performances
Takacs Quartet: Bartok Cycle,Performing Arts - Music,2014-03-23T15:00:00,2014-03-23T16:00:00,Hertz Concert Hall,Cal Performances,"the complete cycle of Bartók string quartets, performed over two consecutive days. Bartók's quartets have been at the very heart of Takács's repertoire since the group was founded in Budapest in 1975, and it was a recording of those works that put... More >",Target audience: All Audiences,Performances
Zakir Hussain and the Masters of Percussion,Performing Arts - Music,2014-03-23T19:00:00,2014-03-23T20:00:00,Zellerbach Hall,Cal Performances,his Masters of Percussion... More >,Target audience: All Audiences,Performances
Les Ballets Trockadero de Monte Carlo,Performing Arts - Dance,2014-03-25T20:00:00,2014-03-25T21:00:00,Zellerbach Hall,Cal Performances,"campy and hysterical, but informed and beautifully executed. The company has become... More >",Target audience: All Audiences,Performances
Cal Night at ODC/Dance Downtown,Performing Arts - Dance,2014-03-26T19:30:00,2014-03-26T20:30:00,Yerba Buena Center for the Arts,"701 Mission Street (at 3rd Street), San Francisco, CA 94103","Cal Alumni Association, ODC/Dance","San Franciscos internationally acclaimed contemporary dance company ODC/Dance celebrates its 43rd season with world premiere boulders and bones featuring an epic lineup of creative catalysts and collaborators, including Andy Goldsworthy, Zoë Keating, and RJ Muna. CAA members save 20% on tickets on March 26.",Performances
"Iestyn Davies, countertenor, and Thomas Dunford, lute",Performing Arts - Music,2014-03-28T20:00:00,2014-03-28T21:00:00,First Congregational Church,"Intersection of Durant Ave and Dana St, Berkeley, CA",Cal Performances,"With a voice that possesses ""the delicacy and refinement of spider silk"" (Financial Times, London) and a sharp interpretive mind to match, British countertenor Iestyn Davies has entered the limelight with scene-stealing operatic roles and intimate recital programs that showcase his ""extraordinary tonal richness and imaginative phrasing"" (The Guardian, London). Davies, accompanied by Thomas Dunford on lute, sings a program of deeply poetic and emotionally dynamic late Tudor and Stuart songs by Dowland, Johnson, and Danyel, as well as a new work by the young and in-demand New York-based composer Nico Muhly.",Performances
Akademie für Alte Musik Berlin: Bach Family,Performing Arts - Music,2014-03-29T20:00:00,2014-03-29T21:00:00,First Congregational Church,"Intersection of Durant Ave and Dana St, Berkeley, CA",Cal Performances,"Boasting some of the finest period-instrument virtuosi in the world, the Akademie für Alte Musik Berlin has earned a reputation for technically brilliant, thoughtfully researched, and outright joyful performances. The ensemble balances precision with passion, bringing the work of Baroque masters to life with an uncanny sense of ensemble cohesion and unparalleled interpretive nuance.",Performances
Ira Glass,Performing Arts - Other,2014-03-29T20:00:00,2014-03-29T21:00:00,Zellerbach Hall,Cal Performances,,Target audience: All Audiences,Performances
Music Studies Colloquium - Voskuhl: Music and Mechanics: Harpsichord-Playing Women Automata and Sentimental Culture in the German Enlightenment,Performing Arts - Music,2014-03-31T16:30:00,2014-03-31T18:00:00,128 Morrison Hall,"Adelheid Voskuhl, University of Pennsylvania",Department of Music,"Two of the famous android automata made in eighteenth-century Europe displayed women playing a keyboard instrument. They were produced in Switzerland and Germany in exceptionally prolific artisan environments. The artisans designed them so that they not merely played music but also performed contemporary sentimental-musical body techniques (through moving their eyes, heads, and torsos) to communicate affects to the audience that were generated by the musical piece. My talk investigates the artisan and musical-cultural environments in which androids and their meanings were produced in the eighteenth century and probes also the boundaries between such different economic and cultural environments. The talk's second part traces how eighteenth-century musical automata's interpretations changed significantly during the industrial revolutions of the 19th and the wars of the 20th centuries: literary and cultural critics detached them from their original musical-historical context and appropriated them as harbingers of the catastrophes of industrial modernity. The musical element of the mechanics of the androids helps me rescue this part of their android identity and thus re-visit both technical and cultural modernities.",Performances
Alvin Ailey American Dance Theater,Performing Arts - Dance,2014-04-01T20:00:00,2014-04-01T21:00:00,Zellerbach Hall,Cal Performances,"re-igniting powerful and stirring Ailey works of the past and inspiring a new generation with contemporary repertoire by exciting living choreographers. For more than 50 years, the company has ranked among America's most beloved cultural treasures, and... More >",Target audience: All Audiences,Performances
UC Berkeley Percussion Ensemble: 61st Annual Noon Concert,Performing Arts - Music,2014-04-02T12:15:00,2014-04-02T13:00:00,Hertz Concert Hall,Department of Music,,Target audience: All Audiences,Performances
Darius Milhaud: The Berkeley Years: Performance by the Left Coast Chamber Ensemble and students at UC Berkeley Department of Music,Performing Arts - Music,2014-04-02T19:00:00,2014-04-02T20:30:00,Magnes Collection of Jewish Art and Life (2121 Allston Way),Department of History,,,Performances
Alvin Ailey American Dance Theater,Performing Arts - Dance,2014-04-02T20:00:00,2014-04-02T21:00:00,Zellerbach Hall,Cal Performances,"re-igniting powerful and stirring Ailey works of the past and inspiring a new generation with contemporary repertoire by exciting living choreographers. For more than 50 years, the company has ranked among America's most beloved cultural treasures, and... More >",Target audience: All Audiences,Performances
Lunch Poems presents Rowan Ricardo Phillips,Reading - Literary,2014-04-03T12:10:00,2014-04-03T13:00:00,"Doe Library, Morrison Library",Library,"poems, winner of the 2013 Great Lakes Colleges Association New Writer Award in Poetry, a finalist for the 2012 Los Angeles Times Book Prize for Poetry, and a finalist for the NAACP Image Award for Outstanding Literary Work in Poetry. He is also the author of a book of criticism, When Blackness Rhymes with Blackness and the... More >",,Performances
Alvin Ailey American Dance Theater,Performing Arts - Dance,2014-04-03T20:00:00,2014-04-03T21:00:00,Zellerbach Hall,Cal Performances,"re-igniting powerful and stirring Ailey works of the past and inspiring a new generation with contemporary repertoire by exciting living choreographers. For more than 50 years, the company has ranked among America's most beloved cultural treasures, and... More >",Target audience: All Audiences,Performances
Composition Colloquium - Georg Hajdu: Recent Work,Performing Arts - Music,2014-04-04T15:10:00,2014-04-04T16:30:00,"Morrison Hall, 125 Morrison, Elkus Room",Georg Hajdu,Department of Music,"Georg Hajdu is professor of multimedia composition and music theory at the Hamburg Hochschule of Music and Theater. His areas of interest include multimedia, microtonality, algorithmic, interactive and networked music performance. Reception follows",Performances
RE@DS: Jasmine Sufi and Leo Bryant: The Reading Room,Reading - Literary,2014-04-04T17:30:00,2014-04-04T18:30:00,Berkeley Art Museum and Pacific Film Archive,Jasmine Sufi; Leo Bryant,Berkeley Art Museum and Pacific Film Archive,"Leo Bryant is a visual artist and writer who has shared his work on stages across the country, including the Great American Music Hall in San Francisco. He develops and facilitates workshops for at-risk youth focused on constructive emotional release and self-expression through art. Bay Area native Jaz Sufi is a poet who, at eighteen, became the slammaster of the legendary Santa Cruz Indie Slam and the youngest slammaster of a PSI-certified venue in the country. In 2011 she was a featured poet at the USF Creative Justice Art Show. In both 2012 and 2013, Sufi was voted Audiences Choice at inkSlam, and in 2013 represented San Francisco at the Women of the World Poetry Slam. Included with L@TE admission",Performances
Creative Growth Beyond Trend Runway Event: L@TE: Friday Nights at BAM/PFA,Performing Arts - Music,2014-04-04T19:30:00,2014-04-04T21:00:00,Berkeley Art Museum and Pacific Film Archive,Berkeley Art Museum and Pacific Film Archive,,"Tickets:$7 General admission, Free BAM/PFA members and UC Berkeley students, faculty, and staff; children under 12",Performances
West African Music and Dance,Performing Arts - Music,2014-04-04T20:00:00,2014-04-04T22:00:00,Hertz Concert Hall,Department of Music,,"Tickets required:$16 general admission, $12 other students, seniors, current & retired Berkeley staff & faculty, groups of 10 or more, $5 UC Berkeley students (student ID required)",Performances
Alvin Ailey American Dance Theater,Performing Arts - Dance,2014-04-04T20:00:00,2014-04-04T21:00:00,Zellerbach Hall,Cal Performances,"re-igniting powerful and stirring Ailey works of the past and inspiring a new generation with contemporary repertoire by exciting living choreographers. For more than 50 years, the company has ranked among America's most beloved cultural treasures, and... More >",Target audience: All Audiences,Performances
Alvin Ailey American Dance Theater,Performing Arts - Dance,2014-04-05T14:00:00,2014-04-05T15:00:00,Zellerbach Hall,Cal Performances,"re-igniting powerful and stirring Ailey works of the past and inspiring a new generation with contemporary repertoire by exciting living choreographers. For more than 50 years, the company has ranked among America's most beloved cultural treasures, and... More >",Target audience: All Audiences,Performances
Alvin Ailey American Dance Theater,Performing Arts - Dance,2014-04-05T20:00:00,2014-04-05T21:00:00,Zellerbach Hall,Cal Performances,"re-igniting powerful and stirring Ailey works of the past and inspiring a new generation with contemporary repertoire by exciting living choreographers. For more than 50 years, the company has ranked among America's most beloved cultural treasures, and... More >",Target audience: All Audiences,Performances
Alvin Ailey American Dance Theater,Performing Arts - Dance,2014-04-06T15:00:00,2014-04-06T16:00:00,Zellerbach Hall,Cal Performances,"re-igniting powerful and stirring Ailey works of the past and inspiring a new generation with contemporary repertoire by exciting living choreographers. For more than 50 years, the company has ranked among America's most beloved cultural treasures, and... More >",Target audience: All Audiences,Performances
David Gonzalez and the Yak Yak Band: Aesop Bops!,Performing Arts - Music,2014-04-06T15:00:00,2014-04-06T16:00:00,Wheeler Auditorium,Cal Performances,,"Target audiences: All Audiences, Children",Performances
Kronos Quartet with Combat Paper Project: A Meditation on the Great War: World Premiere!,Performing Arts - Music,2014-04-06T19:00:00,2014-04-06T20:00:00,Hertz Concert Hall,Cal Performances,,Target audience: All Audiences,Performances
Music Studies Colloquium - Wong: Rereading Ethnomusicology for Gender and Erotics,Performing Arts - Music,2014-04-07T16:30:00,2014-04-07T18:00:00,128 Morrison Hall,"Deborah Wong, UC Riverside",Department of Music,"How and why did gender studies move so quickly through ethnomusicology, and then (mostly) disappear? Why has sexuality studies barely made any appearance at all, despite musics central role in shaping desire? Ethnomusicology moved to a post-gender stance with lightning speed. That is, after key publications about women/gender and music in the 1980s-90s, ethnomusicologists began to add the phrase and gender to their arguments but to a great extent stopped focusing on it. As Ellen Koskoff has written, after a brief spurt in the late 1980s and into the 1990s, work in feminist and genderist ethnomusicology seemed to slow in relation to that of musicology(Koskoff 2005, 90). I offer a reclamation model meant to dialogically regroup, recoup, and reformulate existing ethnomusicological scholarship. Attention to gendered orders of music is missing from much of our most treasured literature, and I aim to reread itto read it anew, to read it with new eyesnot in order to rescue it but to fold the gesture of critique into our work as I make visible the invisibility of gender in so much of our best scholarship. This is in some ways homage and in others an openly counterfactual history. I will reread my own book on Thai music by folding in current media coverage of spectacularly misogynistic demonstrations against the female Prime Minister. I will reread several key monographs by other ethnomusicologists to consider the range of acts available to usradical rereading, evocative/poetic rereading, mournful rereadingwhile arguing that this agentive feminist act of reading (refusing the apparent absence) is an extension of the gaze exerted by subalterns of many kinds in many places. I aim to activate a bifocal consciousness and to exert the black look articulated by bell hooks to theorize a reading method for ethnomusicologists that traces the ghostly presence of gender and erotics, reading around their apparent absence for their outlines and sonic traces. I will draw from the abundance of theories addressing the act of oppositional watching/listening and theories for rereading from philosophy and education, which emphasize how re-knowing and re-cognition is part of the rereading process. Can a second reading open up a third space? Neither a rescue operation nor an apologist celebration, this is instead a deeply necessary and respectful effort to reengage with (rather than disengage from) leading scholarship by ethnomusicologists that has mostly turned a blind eye toward gender and sexuality. I offer both a practical method and a theory of rereading drawn from feminist theory, minoritarian studies, and translation studies.",Performances
Jorie Graham - Holloway Poetry Reading,Reading - Literary,2014-04-08T18:30:00,2014-04-08T20:00:00,"Wheeler Hall, Maude Fife Room #315",Department of English,"Hybrids of Plants and of Ghosts, Erosion, The End of Beauty, Region of Unlikeness, Materialism, The Errancy, Swarm, and Never. Her selected poems, The Dream of the Unified Field, won the Pulitzer Prize in 1996.",,Performances
Farallon Quintet: 61st Annual Noon Concert,Performing Arts - Music,2014-04-09T12:15:00,2014-04-09T13:00:00,Hertz Concert Hall,Department of Music,,Target audience: All Audiences,Performances
Story Hour in the Library featuring Ayelet Waldman,Reading - Literary,2014-04-10T17:00:00,2014-04-10T18:00:00,"Doe Library, Morrison Library",Ayelet Waldman,Library,"New York Times best-selling author Ayelet Waldmans new novel, Love and Treasure, was called a treasure trove by Joyce Carol Oates. Previous books include Red Hook Road and Bad Mother: A Chronicle of Maternal Crimes, Minor Calamities and Occasional Moments of Grace. Her novel Love and Other Impossible Pursuits was made into a film starring Natalie Portman. Waldmans personal essays, profiles and commentaries have appeared in the New York Times, Vogue, the Washington Post, the Wall Street Journal, ""All Things Considered"" and ""The California Report.""",Performances
Composition Colloquium - Erin Gee: Recent Work,Performing Arts - Music,2014-04-11T15:10:00,2014-04-11T16:30:00,"Morrison Hall, 125 Morrison, Elkus Room",Erin Gee,Department of Music,"Erin Gee is on the composition-theory faculty at the University of Illinois, School of Music. Prof. Gee has received numerous awards and honors, including the Rome Prize in 2007, a Fellowship at the Radcliffe Institute for Advanced Study in Cambridge in 2009, a Civitella Ranieri Fellowship in Italy in 2011 and the Guggenheim Fellowship. Reception follows",Performances
RE@DS: Gillian Osborne and Simona Schneider: The Reading Room,Reading - Literary,2014-04-11T17:30:00,2014-04-11T18:30:00,Berkeley Art Museum and Pacific Film Archive,Gillian Osborne; Simona Schneider,Berkeley Art Museum and Pacific Film Archive,"Gillian Osborne is a Ph.D. candidate in English at UC Berkeley. She studies American literature, poetry, and nineteenth-century metaphors composed of plants. Born in Boston, Simona Schneider is a Ph.D. candidate in comparative literature at UC Berkeley studying literature, film, and visual art. Her poems have appeared in The Brooklyn Rail, Coconut, Qui Parle, and The Columbia Review. Included with L@TE admission",Performances
