title,event_type,start_at,end_at,location,speaker,sponsor,details,group
A Reassessment of Hebbian Mechanisms in Visual System Development by in vivo Imaging,Seminar: Seminars of interest,2014-03-03T11:00:00,2014-03-03T12:30:00,489 Minor Hall,"Edward S. Ruthazer, Montreal Neurological Institute, McGill University","Neuroscience Institute, Helen Wills","I n 1949 Donald Hebb put forth an influential model proposing that learning may be manifested by a growth process between neuronal partners in the brain that exhibited correlated firing such that the presynaptic cell had participated in causing its postsynaptic partner to fire. The NMDA receptor has been identified as a molecular detector of correlated firing due to its voltage-dependence. Developmental refinement of neuronal circuits is also thought to exploit similar correlation-dependent mechanisms. Consistent with this idea, numerous studies have shown that NMDA receptor blockade or genetic knockout disrupts normal developmental plasticity and circuit refinement. Using a combination of targeted genetic manipulation, and time lapse imaging of axonal remodeling in response to patterned visual stimuli in vivo, we explore the contributions of correlated firing and NMDA receptors in the Xenopus retinotectal system, a classic experimental model for the study of activity-dependent visual system refinement.",BioE
View from the Top: From the Ground Up: Rethinking Undergraduate Engineering Education,Lecture: Seminars of interest,2014-03-04T12:00:00,2014-03-04T13:00:00,"Sutardja Dai Hall, Banatao Auditorium, 3rd floor","Richard K. Miller, President, Olin College of Engineering","College of Engineering, Berkeley chapter of the American Society of Mechanical Engineers (ASME).","For more than a decade, Olin College of Engineering has been exploring three questions with regard to engineering education:  Are we attracting the right people into engineering?  Are we teaching them the right material?  Are we using the most effective teaching methods? This talk will present an overview of lessons learned in each area through experimentation at Olin College.",BioE
Age-related Stem Cell Dysfunction: Causes and Consequences: Life Sciences Division Seminar,Seminar: Seminars of interest,2014-03-04T16:00:00,2014-03-04T17:00:00,"Berkeley Lab (LBNL) at 717 Potter Street, Room 141","717 Potter Street, Berkeley, CA 94710","Henrich Jasper, Ph.D., Buck Institute for Research on Aging","Sponsor: Life Sciences Division, LBNL",BioE
How Can Telomeres Cause Age-Related Disease?: Charles M. and Martha Hitchcock Lectures by Carol Greider,Lecture: Grad,2014-03-04T16:10:00,2014-03-04T17:10:00,"International House, Chevron Auditorium","Carol Greider, Daniel Nathans Professor and Director of Molecular Biology and Genetics, Johns Hopkins University",Graduate Division,"Carol Greider will present the Hitchcock lectures on March 4 and March 5, 2014. The first lecture is entitled ""How Can Telomeres Cause Age-Related Disease?"" The lecture is free and open to the public. No tickets are required.",BioE
BioE Seminar: Engineering 3D multicellular microenvironments to direct stem cell differentiation and morphogenesis,Seminar: BioE Seminars,2014-03-05T12:00:00,2014-03-05T13:00:00,106 Stanley Hall,"Todd McDevitt, Georgia Institute of Technology and Emory University",Bioengineering (BioE),"Wednesday, March 5 12noon - 1:00pm 106 Stanley Hall, UC Berkeley Engineering 3D multicellular microenvironments to direct stem cell differentiation & morphogenesis Todd McDevitt Carol Ann and David D. Flanagan Associate Professor in the Wallace H. Coulter Department of Biomedical Engineering Georgia Institute of Technology and Emory University Stem cells offer tremendous promise as the basis of regenerative therapies due to their inherent capacity for differentiation into various cell types and their potent ability to secrete a unique cadre of morphogenic, anti-inflammatory and immunomodulatory factors. Engineering the properties of 3D stem cell microenvironments offers a means of regulating their fate and function in an analogous format to the multicellular organization of primitive developing tissues. Simple multicellular aggregates of stem cells permit differentiation and morphogenesis of complex tissue structures, as demonstrated by numerous recent organoid examples, and are directly amenable to scalable suspension culture techniques. Thus, we have taken a systematic approach to the engineering of pluripotent and multipotent stem cell aggregates in order to examine the effects of biophysical and biochemical cues on cell fate, morphogenesis, and secretory function for the purposes of creating in vitro model systems, developing scalable biomanufacturing technologies, and directing innate trophic delivery and regenerative potential. We have demonstrated through a series of studies that hydrodynamic forces created within mixed suspension culture can modulate differentiation and extracellular matrix and growth factor expression of homogeneous populations of pluripotent stem cell aggregates. We have also pioneered the incorporation of different types of biomaterials within 3D aggregates of stem cells as a means of spatiotemporally controlling the delivery of exogenous factors and sequestering of endogenous morphogens that impact stem cell phenotype. More recently we have developed quantitative analytical methods and computational modeling approaches to assess the cellular composition, mechanical properties and patterns of differentiation within single aggregates to complement our experimental efforts to dissect the mechanisms regulating stem cell fate decisions. The sum of these strategies is intended to enhance our understanding of the governing principles dictating stem cell morphogenesis and ultimately translate the potential of stem cells into viable cell-based therapies and diagnostics that transform the future of biomedical research and healthcare practices. Hosted by Professor Kevin Healy",BioE
"Telomeres and Telomerase: Past, Present, and Future: Charles M. and Martha Hitchcock Lectures by Carol Greider",Lecture: Grad,2014-03-05T16:10:00,2014-03-05T17:10:00,"International House, Chevron Auditorium","Carol Greider, Daniel Nathans Professor and Director of Molecular Biology and Genetics, Johns Hopkins University",Graduate Division,"Carol Greider will present the Hitchcock lectures on March 4 and March 5, 2014. The second lecture is entitled ""Telomeres and Telomerase: Past, Present, and Future."" The lecture is free and open to the public. No tickets are required.",BioE
Stem Cell Niche in Homeostasis and Cancer,Seminar: Seminars of interest,2014-03-06T16:00:00,2014-03-06T17:00:00,100 Genetics & Plant Biology Building,"David Scadden, Massachusetts General Hospital",Department of Molecular and Cell Biology,,BioE
Engineering Biological Tissue for Relieving Back Pain: Nano Seminar Series,Seminar: Seminars of interest,2014-03-07T14:00:00,2014-03-07T15:00:00,390 Hearst Memorial Mining Building,"Prof. Grace O'Connell, UC Berkeley, Mechanical Engineering",Berkeley Nanosciences and Nanoengineering Institute,"The musculoskeletal system is comprised of large load bearing soft tissues that absorb and distribute the complex loads placed on the joint. The intervertebral disc is comprised of mechanically and structurally unique substructures including the annulus fibrosus and the nucleus pulposus, which function together to support and absorb spinal loads. Disc degeneration occurs as early as the second decade of life and contributes to over $130 billion in medical costs. Disc degeneration causes drastic changes in composition and may lead to altered mechanics; however, the changes in the internal mechanical function of the nucleus and annulus are not well understood. Moreover, injury of the disc, such as herniation of nucleus pulposus material through the annulus fibrosus, causes low back pain and may alter the mechanical function of the disc. Removal of the herniated nucleus pulposus material alleviates low back pain, but may alter the internal mechanical function, which may lead to further degenerative changes. Noninvasive techniques to measure internal mechanical properties will be discussed. Future effective treatment for herniated tissue may include an engineered biological replacement tissue, which may prevent further degeneration and reduce the need for total joint replacement or spinal fusion. One approach to biological repair strategies that will be discussed is to cultivate engineered tissue in vitro, permitting some elaboration of extracellular matrix for improved long-term outcome following in vivo implantation.",BioE
Plasmon-Enabled Processes: New Opportunities in Chemical Science and Emerging Technologies,Seminar: Seminars of interest,2014-03-11T16:00:00,2014-03-11T17:00:00,"Pitzer Auditorium, 120 Latimer Hall","Professor Naomi Halas, Department of Electrical & Computer Engineering, Rice University",Department of Chemistry,"Coffee and Refreshments served at the ""Coffee Lab"" B38 Hildebrand - available @ 3:50pm",BioE
BioE Seminar: The Design of Nanoscale Therapeutics and Nanostructured Materials,Seminar: BioE Seminars,2014-03-12T12:00:00,2014-03-12T13:00:00,106 Stanley Hall,"Ravi Kane, Rensselaer Polytechnic Institute",Bioengineering (BioE),"Spring 2014 Seminar Series Wednesday, March 12 12noon - 1:00pm 106 Stanley Hall, UC Berkeley The Design of Nanoscale Therapeutics and Nanostructured Materials Ravi Kane P. K. Lashmet Professor of Chemical and Biological Engineering Rensselaer Polytechnic Institute This talk will describe our efforts to interface bioactive molecules with nanomaterials and nanoscale scaffolds for designing potent therapeutics and functional nanocomposites. The design of polyvalent molecules presenting multiple copies of a specific ligand represents a promising strategy to inhibit pathogens and bacterial toxins. We will first describe the design of polyvalent inhibitors that are orders of magnitude more active than the corresponding monovalent molecules and can neutralize anthrax toxin in vivo. We recently described a thermodynamic analysis to help clarify the theoretical basis for the large enhancements in avidity due to polyvalency. We have used this understanding to guide the structure-based design of potent synthetic polyvalent ligands. The ability to control independently the valency and the spacing between ligands is particularly valuable for these design efforts. To that end, we recently designed monodisperse polypeptide-based polyvalent inhibitors of anthrax toxin in which multiple copies of an inhibitory toxin-binding peptide were separated by flexible peptide linkers. By tuning the valency and linker length, we designed polyvalent inhibitors that were over four orders of magnitude more potent than the corresponding monovalent ligands. Studies relating the composition and structure of polyvalent inhibitors to their activity have also shed light on fundamental aspects of polyvalent recognition, including the role of pattern matching. We will also discuss other applications of polyvalent molecules ranging from the inhibition of pathogens (e.g., the influenza virus) to controlling the nanoscale organization of cellular receptors to regulate signaling and stem cell fate. In addition to the inhibition of bacterial toxins, we are also investigating approaches to target pathogenic bacteria. In particular, the emergence of antimicrobial resistance has been a growing concern. We have been exploring an enzyme-based approach to combat pathogenic bacteria. We will describe an approach that we have developed to identify novel bacteriolytic enzymes targeting a variety of bacterial pathogens. We have also investigated the structure and function of these and other enzymes when immobilized onto nanomaterials such as carbon nanotubes. Our studies indicate that the nanoscale environment can significantly influence the activity and stability of these proteins. We have used the highly stable and active nanomaterial-protein conjugates to form nanocomposite films that are effective against antibiotic-resistant bacteria including methicillin-resistant S. aureus (MRSA). Hosted by Professor David Schaffer",BioE
Epidermal Stem Cells and the Genesis of Squamous Cell Carcinoma,Seminar: Seminars of interest,2014-03-12T12:30:00,2014-03-12T13:30:00,101 Life Sciences Addition,"**Andrew C. White**, University of California, Los Angeles, Molecular, Cell and Developmental Biology",Department of Molecular and Cell Biology,,BioE
"Antimicrobial Applications of Ambient-Air Plasmas: Matthew Pavlovich and Yongkwan Kim, PhD Students",Colloquium: Seminars of interest,2014-03-12T16:00:00,2014-03-12T18:00:00,180 Tan Hall,"Matthew Pavlovich, PhD student, Graves Group; Yongkwan Kim, PhD Student, Maboudian Group",Department of Chemical Engineering,"Matthew Pavlovich, Ph.D student in the Graves Group: Antimicrobial Applications of Ambient-Air Plasmas Yongkwan Kim, Ph.D student in the Maboudian Group: Fabrication and Characterization of Gecko-inspired Fibrillar Adhesive",BioE
Where the Wild Genes Are: Moses Memorial Lecture by Aihwa Ong,Lecture: Grad,2014-03-12T16:10:00,2014-03-12T17:10:00,"Alumni House, Toll Room","Aihwa Ong, Professor of Socio-cultural Anthropology, University of California, Berkeley",Graduate Division,"Aihwa Ong will present the Moses Lecture on March 12, 2014. The lecture entitled ""Where the Wild Genes Are"" will commence at 4:10 pm. This event is free and open to the public. No tickets are required.",BioE
"Spherical Nucleic Acids as Programmable Atom Equivalents: Constructing a New ""Table of Elements"": Nano Seminar Series",Seminar: Seminars of interest,2014-03-14T14:00:00,2014-03-14T15:00:00,390 Hearst Memorial Mining Building,"Prof. Chad A. Mirkin, Northwestern University, Chemistry / Int'l Institute for Nanotechnology",Berkeley Nanosciences and Nanoengineering Institute,"The crystallographic parameters of atomic and ionic solids are fixed by the size and coordination number of their elemental building blocks, thus restricting the types of structures that can be formed. We have demonstrated that these limitations can be overcome using spherical nucleic acids (SNAs) as artificial atoms in nanoparticle superlattice assemblies. These three-dimensional conjugates consist of densely functionalized, highly oriented nucleic acids covalently attached to the surface of inorganic nanoparticles. The strength and length of the programmable DNA bonds between these structures can be adjusted by varying DNA sequence and length, and the properties of the atoms can be adjusted by varying nanoparticle size, shape, and composition. We have developed design rules for this assembly process, analogous to Paulings Rules for ionic solids but ultimately more powerful. These rules can be used as a guide for the rational construction of functional nanoparticle-based materials for plasmonic, photonic, and catalytic applications.",BioE
Electric Fields and Cells: A Productive Partnership: Nano Seminar Series,Seminar: Seminars of interest,2014-03-21T14:00:00,2014-03-21T15:00:00,390 Hearst Memorial Mining Building,"Prof. Joel Voldman, MIT, Electrical Engineering",Berkeley Nanosciences and Nanoengineering Institute,"Microsystems have the potential to impact biology by providing new ways to manipulate cells. Simply physically manipulating cellsusing microfluidics, electric fields, or optical forcesprovides new ways to separate cells and organize cell-cell interactions. We have been exploiting microscale electric fields to manipulate cells in a variety of ways. One example is to sort cells based on their intrinsic electrical properties, which we have applied to understand the genetic basis of electrical properties, as well as apply for point-of-care cell-based assays. Another is to use electric fields to guide the growth of axons, which we can do in 3D and in a non-contact fashion, allowing generation of topologically complex in vitro neural networks. Together, these new microscale tools provide ways to exploit cells potential for both basic science and applied biotechnology.",BioE
Seventh Annual Berkeley Bioeconomy Conference,Conference/Symposium: Seminars of interest,2014-03-26T08:30:00,2014-03-26T17:30:00,"Alumni House, Toll/Bechtel",Energy Biosciences Institute,"Biofuel as Part of a Sustainable Strategy, March 26 and 27, 2014, U.C. Berkeley Alumni House.",,BioE
Retinoblastoma: Bridging Developmental Neurobiology and Cancer Genetics,Seminar: Seminars of interest,2014-03-31T11:00:00,2014-03-31T12:30:00,489 Minor Hall,"Michael Dyer, Member, Department of Developmental Neurobiology HHMI Investigator Head, Division of Developmental Biology Co-Leader, Developmental Biology and Solid Tumor Program","Neuroscience Institute, Helen Wills",,BioE
Single-Molecule Spectroscopy and Imaging: 3D Nanoscopy and Biomolecular Dynamics,Seminar: Seminars of interest,2014-04-01T16:00:00,2014-04-01T17:00:00,"Pitzer Auditorium, 120 Latimer Hall","Professor W.E. Moerner, Deparment of Chemistry, Stanford University",Department of Chemistry,"Coffee and Refreshments served at the ""Coffee Lab"" B38 Hildebrand - available @ 3:50pm",BioE
"First-Principles Prediction of Small Molecule Adsorption in Metal-Organic Frameworks: Joshua Howe and Li-Chiang Lin, PhD Students",Colloquium: Seminars of interest,2014-04-02T16:00:00,2014-04-02T18:00:00,180 Tan Hall,"Joshua Howe, PhD student, Smit Group; Li-Chiang Lin, PhD Student, Smit Group",Department of Chemical Engineering,"Joshua, Ph.D student in the Smit Group: First-Principles Prediction of Small Molecule Adsorption in Metal-Organic Frameworks Li-Chiang Lin, Ph.D student in the Smit Group: From Molecular Simulations to Gas Separation and Storage Applications",BioE
Personalizing Cancer Diagnostics Using Microfluidics: Nano Seminar Series,Seminar: Seminars of interest,2014-04-04T14:00:00,2014-04-04T15:00:00,390 Hearst Memorial Mining Building,"Prof. Albert Folch, Univ. of Washington, Bioengineering",Berkeley Nanosciences and Nanoengineering Institute,"Cancer therapy has a critical unmet need, which is to identify the best therapy for individual cancer patients. There are currently over 250 FDA-approved drugs for cancer chemotherapy. Most of these were identified and are applied empirically, either alone or in combination, to treat cancer. Drug choice is guided largely by a) tumor type, location and stage, and b) efficacy of therapy as assessed in prior clinical trials using groups of patients. The response of individual patients to these standard-of-care therapies often varies widely. Ineffective therapies extract an enormous toll on individual patients and their families as well as on the health care system. A more rational and cost-effective way to improve cancer therapy, maximize the likelihood of response or cure, and minimize toxicity, would be to assess tumor response to chemotherapeutic agents before starting therapy. We have developed a multiplexed microfluidic assay designed to identify the best therapy for individual cancer patients. This assay utilizes intact tissue in order to rapidly predict tumor chemosensitivity to a large panel of drugs prior to initiation of therapy. The assay complements current genetic characterizations of tumor variation between individuals and should greatly speed up the testing of new drugs in research settings. I will demonstrate how bringing these microfluidic devices into the clinic will greatly enabled by the use of stereolithography, a form of 3D printing.",BioE
Surface Reactions in Energy Technologies: Thermodynamics and Kinetics for Improving Catalytic Nanomaterials and Photovoltaic Devices,Seminar: Seminars of interest,2014-04-08T16:00:00,2014-04-08T17:00:00,"Pitzer Auditorium, 120 Latimer Hall","Professor Charles T. Campbell, Department of Chemistry & Chemical Engineering, University of Washington",Department of Chemistry,"Coffee and Refreshments served at the ""Coffee Lab"" B38 Hildebrand - available @ 3:50pm",BioE
Hematopoietic stem cells: regulation of location and engraftment,Seminar: Seminars of interest,2014-04-09T16:10:00,2014-04-09T17:10:00,114 Morgan Hall,"Camilla Forsberg, Ph.D., Associate Professor, Biomolecular Engineering, UC Santa Cruz, Department Biomolecular Engineering",Nutritional Sciences and Toxicology,,BioE
Engineering Biological Cell Access: Nano Seminar Series,Seminar: Seminars of interest,2014-04-11T14:00:00,2014-04-11T15:00:00,390 Hearst Memorial Mining Building,"Prof. Nicholas A. Melosh, Stanford University, Materials Science & Engineering",Berkeley Nanosciences and Nanoengineering Institute,"The cell membrane is one of the most vital components of a cell; the gate-keeper into and out of the cytoplasm. Studies ranging from neural activity to drug discovery to fundamental cell physiology rely upon controlling electronic or chemical flow across this barrier. Unfortunately, our ability to artificially control cellular access is surprisingly poor; current techniques often involve creating holes in or puncturing cell membranes that often cause rapid cell death. Yet precise, non-destructive access to the cell interior can lead to an impressive range of new techniques and devices, ranging from neural-prosthetic interfaces, electrical cell monitoring for disease, to rapid drug screening. These types of technologies are particularly important for the recently announced Brain Activity Map and for harnessing the potential of induced pluripotent stem cells as disease models and clinical indicators. One of the critical problems is that we have little knowledge of what happens when the lipid membrane interacts with cell-penetrating materials. Here we explore how inorganic materials with nanoscale molecular functionalization influence and control this vital interface. We discovered that by selectively tuning the hydrophobicity and flexibility of the molecular functionalization we can replicate many of the design features of natural transmembrane proteins, providing non-disruptive mechanical, electrical and chemical access into the cell. These Stealth probes spontaneously insert into lipid membrane, and form tight lipid-post junctions. Force testing with atomic force microscopy (AFM) provides a quantitative measure of interfacial adhesion, which surprisingly reveals significant adhesion energy differences between molecular groups with similar hydrophobicity but different mobility. This contradicts traditional hydrophobicity indices as indicators of molecular stability in lipid membranes. Similarly, we achieved high-efficiency chemical delivery and control by mimicking nature gap junction proteins to create nanostraw arrays. These nanoscale (100-500 nm) diameter straws are formed based on simple water filtration membranes, and spontaneously penetrate cells plated onto them. We find these provide permanent conduits into cells, permitting delivery of a wide variety of materials that could normally not pass through the cell wall. These two technologies are examples of how the combination of physical sciences and biology can create new beneficial devices that would not be possible in isolation.",BioE
ITIM-receptors: surprising roles in hematopoietic stem cells and leukemia cells,Seminar: Seminars of interest,2014-04-23T16:10:00,2014-04-23T17:10:00,114 Morgan Hall,"Chengcheng (Alec) Zhang, Ph.D., Associate Professor, Departments of Physiology, and Developmental Biology",Nutritional Sciences and Toxicology,,BioE
Distinguished Teaching Award,Special Event: Event,2014-04-23T17:00:00,2014-04-23T19:00:00,Zellerbach Playhouse,"Center for Teaching and Learning, Academic Senate",,Target audience: All Audiences,BioE
Effects of stress controllability on subsequent responses to stressors,Seminar: Seminars of interest,2014-04-25T11:00:00,2014-04-25T12:30:00,5101 Tolman Hall,"Consuelo Soliz, Bishop Lab","Neuroscience Institute, Helen Wills",Student Research Presentation,BioE
Recent Progress with Nanowires: Growth and Energy Applications: Nano Seminar Series,Seminar: Seminars of interest,2014-04-25T14:00:00,2014-04-25T15:00:00,390 Hearst Memorial Mining Building,"Prof. Lars Samuelson, Nano Structure Consortium Founder, Lund University, Sweden",Berkeley Nanosciences and Nanoengineering Institute,"The scientific field of (compound) semiconductor nanowires got started seriously in the US and in Europe about 15 years ago, some ten years after the original break-through research conducted by Dr. Kenji Hiruma and his team at Hitachi in Japan. Our own early work was initially very much exploratory research, testing to what extent we could understand, control and have fun with the ways in which nanowires nucleate and grow. The whole field of nanowires saw great progress in the use of nanowires for physics and for fairly simple model devices. Just in the last five, or so, years we have seen serious break-through in novel growth methods and the understanding of nanowire growth, as well as in the development of new technologies enabling efficient fabrication of nanowires for areas like solar cells and light-emitting diodes. In this talk I will cover all these areas, with an emphasis on recent progress in controlled and efficient fabrication of nanowires for energy applications.",BioE
