title,event_type,start_at,end_at,location,speaker,sponsor,details,group
Engineering Biological Cell Access: Nano Seminar Series,Seminar,2014-04-11T14:00:00,2014-04-11T15:00:00,390 Hearst Memorial Mining Building,"Prof. Nicholas A. Melosh, Stanford University, Materials Science & Engineering",Berkeley Nanosciences and Nanoengineering Institute,"The cell membrane is one of the most vital components of a cell; the gate-keeper into and out of the cytoplasm. Studies ranging from neural activity to drug discovery to fundamental cell physiology rely upon controlling electronic or chemical flow across this barrier. Unfortunately, our ability to artificially control cellular access is surprisingly poor; current techniques often involve creating holes in or puncturing cell membranes that often cause rapid cell death. Yet precise, non-destructive access to the cell interior can lead to an impressive range of new techniques and devices, ranging from neural-prosthetic interfaces, electrical cell monitoring for disease, to rapid drug screening. These types of technologies are particularly important for the recently announced Brain Activity Map and for harnessing the potential of induced pluripotent stem cells as disease models and clinical indicators. One of the critical problems is that we have little knowledge of what happens when the lipid membrane interacts with cell-penetrating materials. Here we explore how inorganic materials with nanoscale molecular functionalization influence and control this vital interface. We discovered that by selectively tuning the hydrophobicity and flexibility of the molecular functionalization we can replicate many of the design features of natural transmembrane proteins, providing non-disruptive mechanical, electrical and chemical access into the cell. These Stealth probes spontaneously insert into lipid membrane, and form tight lipid-post junctions. Force testing with atomic force microscopy (AFM) provides a quantitative measure of interfacial adhesion, which surprisingly reveals significant adhesion energy differences between molecular groups with similar hydrophobicity but different mobility. This contradicts traditional hydrophobicity indices as indicators of molecular stability in lipid membranes. Similarly, we achieved high-efficiency chemical delivery and control by mimicking nature gap junction proteins to create nanostraw arrays. These nanoscale (100-500 nm) diameter straws are formed based on simple water filtration membranes, and spontaneously penetrate cells plated onto them. We find these provide permanent conduits into cells, permitting delivery of a wide variety of materials that could normally not pass through the cell wall. These two technologies are examples of how the combination of physical sciences and biology can create new beneficial devices that would not be possible in isolation.",Nanosciences
Understanding Materials for Solar Fuel Production: Nano Seminar Series,Seminar,2014-04-18T14:00:00,2014-04-18T15:00:00,390 Hearst Memorial Mining Building,"Prof. Dunwei Wang, Boston College, Dept. of Chemistry",Berkeley Nanosciences and Nanoengineering Institute,"Solar energy represents a renewable source that has the potential to meet our ever-increasing energy demand without devastating the environment. One approach to harvesting the energy is to carry out light-powered chemical reactions. Thermodynamically uphill, these reactions produce energetic chemicals that can be used as fuels, promising a large-scale energy storage solution. To enable these reactions, we need materials that can absorb light, separate charges, and catalyze specific chemistries. The materials should be made of earth-abundant elements to allow for large-scale implementations. They also need to be resistant against photo corrosion. To date, a low-cost, long-lasting material that can produce solar fuels with a high efficiency remains elusive. In this talk, we present our efforts aimed at understanding what limits the performance of materials in solar fuel generation reactions. Within the context of photoanode and photocathode, we show how the photoelectrode properties are changed by introducing material components designed for improving charge transport, surface potential accumulation, and interface kinetics, respectively. We also demonstrate that highly complex organic molecules can be produced by photoreduction of CO2, in a fashion closely mimicking the dark reactions in natural photosynthesis. This body of work is enabled by our ability to synthesize materials with precisely controlled surfaces and interfaces using methods such as atomic layer deposition. Our results highlight the importance of understanding thermodynamic and kinetic factors in complex systems such as that for solar fuel production separately. Detailed knowledge generated by our research contributes to the goal of realizing low-cost, high-efficiency artificial photosynthesis.",Nanosciences
Recent Progress with Nanowires: Growth and Energy Applications: Nano Seminar Series,Seminar,2014-04-25T14:00:00,2014-04-25T15:00:00,390 Hearst Memorial Mining Building,"Prof. Lars Samuelson, Nano Structure Consortium Founder, Lund University, Sweden",Berkeley Nanosciences and Nanoengineering Institute,"The scientific field of (compound) semiconductor nanowires got started seriously in the US and in Europe about 15 years ago, some ten years after the original break-through research conducted by Dr. Kenji Hiruma and his team at Hitachi in Japan. Our own early work was initially very much exploratory research, testing to what extent we could understand, control and have fun with the ways in which nanowires nucleate and grow. The whole field of nanowires saw great progress in the use of nanowires for physics and for fairly simple model devices. Just in the last five, or so, years we have seen serious break-through in novel growth methods and the understanding of nanowire growth, as well as in the development of new technologies enabling efficient fabrication of nanowires for areas like solar cells and light-emitting diodes. In this talk I will cover all these areas, with an emphasis on recent progress in controlled and efficient fabrication of nanowires for energy applications.",Nanosciences
Developing Quantum Dot Solids for Thin-Film Photovoltaics: Nano Seminar Series,Seminar,2014-05-02T14:00:00,2014-05-02T15:00:00,390 Hearst Memorial Mining Building,"Prof. Matt Law, UC Irvine, Chemical Engineering",Berkeley Nanosciences and Nanoengineering Institute,"Colloidal semiconductor quantum dots (QDs) are attractive building blocks for solar photovoltaics (PV). In this talk, I will provide an overview our ongoing efforts to design lead salt QD thin film absorbers for next-generation PV. Basic requirements for QD absorber layers include efficient light absorption, charge separation, charge transport, and long-term stability. I will first discuss several methods used to make conductive QD films by solution deposition and ligand exchange. Studies of carrier mobility as a function of basic film parameters such as inter-QD spacing, QD size, and QD size distribution have led to a better understanding of charge transport within highly disordered QD films. Efforts to improve carrier mobility by enhancing inter-dot electronic coupling, passivating surface states, and implementing rudimentary doping will be highlighted. Engineering the inter-QD matrix to produce QD/inorganic or QD/organic nanocomposites is introduced as a promising way to optimize coupling, remove surface states, and achieve long-term environmental stability for high-performance, robust QD films. To obtain large photocurrent from QD solar cells, it is critical to increase the minority carrier diffusion length to rival the optical absorption length, possibly by harnessing band-like transport through extended electronic states. The relative roles of superlattice order, energy disorder, and surface states in this regard will be summarized. The talk will conclude with comments on the prospects for controlled doping and rational p-n junction formation in QD systems.",Nanosciences
Political Economy Research Lunch,Seminar: Political Economy,2014-03-03T12:30:00,2014-03-03T14:00:00,223 Moses Hall,"Jack Paine, UC Berkeley Political Science",Berkeley Center for Political Economy,,Economics
"Seminar E295, Survey of Research: Financial Economics",Seminar: Survey of Research in Economics,2014-03-03T13:10:00,2014-03-03T14:00:00,"Evans Hall, 648 Evans",Ulrike Malmendier; Brad DeLong,Department of Economics,Target audience: Students - Graduate,Economics
"Seminar 231, Public Finance: ""Research clusters: How public subsidies matter?""",Seminar: Public Finance,2014-03-03T14:00:00,2014-03-03T15:30:00,639 Evans Hall,Emmanuelle Taugourdeau,Robert D. Burch Center for Tax Policy and Public Finance,visiting CEG,Economics
"Economics 211: Berkeley Economic History Laboratory (BEHL) Weekly Seminar: Urbanization in Europe -- Regional Variations, 1700-1900",Seminar: Economic History,2014-03-03T14:00:00,2014-03-03T16:00:00,597 Evans Hall,"Davide Cantoni, Professor of Economics, Ludwig-Maximilians-Universitate Munchen & Visiting Scholar, BEHL/UC Berkeley",Department of Economics,,Economics
"Seminar 271, Development: ""Debates: The Impacts of Voter Knowledge Initiatives in Sierra Leone""",Seminar: Development and Planning,2014-03-03T16:00:00,2014-03-03T17:30:00,648 Evans Hall,"Katherine Casey, Stanford University","Department of Economics, CEGA - Center for Effective Global Action",,Economics
"Seminar 208, Microeconomic Theory: ""A Tractable Quantitative Model of Default and Asset-Backed Securities""",Seminar: Microeconomic Theory,2014-03-03T16:00:00,2014-03-03T17:30:00,639 Evans Hall,"Alexis Toda, UCSD",Department of Economics,,Economics
"Seminar 217, Risk Management: ""Introduction to Optimal Control Theory""",Seminar: Risk Management,2014-03-04T10:00:00,2014-03-04T11:30:00,639 Evans Hall,Peter Vinella,Department of Economics,,Economics
Development Lunch: Income Opportunities and Sea Piracy in Indonesia - Evidence from Satellite Data,Seminar: Development Lunch,2014-03-04T12:30:00,2014-03-04T13:30:00,648 Evans Hall,Sebastian Axbar,"Department of Economics, Center for Effective Global Action -- CEGA",,Economics
"Seminar 281, International: The Dynamics of Comparative Advantage""",Seminar: International Trade & Finance,2014-03-04T14:00:00,2014-03-04T15:30:00,597 Evans Hall,"Gordon Hanson, UC SanDiego","Department of Economics, Clausen Center for International Business & Policy",,Economics
"Seminar 237, Macro: The Dynamics of Comparative Advantage""",Seminar: Macroeconomics,2014-03-04T14:00:00,2014-03-04T15:30:00,597 Evans Hall,"Gordon Hanson, UC SanDiego","Department of Economics, Clausen Center for International Business & Policy",,Economics
"Seminar 218, Psych and Econ: ""Can Marginal Rates of Substitution Be Inferred From Happiness Data? Evidence from Residency Choices""",Seminar: Psychology and Economics,2014-03-04T14:00:00,2014-03-04T15:30:00,648 Evans Hall,"Dan Benjamin, Cornell University",Department of Economics,Host: Stefano DellaVigna,Economics
"Seminar 281, International: The Dynamics of Comparative Advantage""",Seminar: International Trade & Finance,2014-03-04T14:00:00,2014-03-04T15:30:00,597 Evans Hall,"Gordon Hanson, UC SanDiego","Department of Economics, Clausen Center for International Business & Policy",,Economics
Berkeley Innovation Seminar: Killing the Golden Goose or Just Chasing it Around the Farmyard?: Generic Entry and the Incentives for Early-Stage Pharmaceutical Innovation,Seminar,2014-03-05T12:00:00,2014-03-05T13:30:00,"Blum Hall, Room 330","Lee Branstetter, Carnegie Mellon",Department of Economics,,Economics
"Seminar 291, Departmental: No Seminar",Seminar: Departmental Seminar,2014-03-05T16:00:00,2014-03-05T17:30:00,648 Evans Hall,Department of Economics,Stefano DellaVigna,,Economics
"Seminar 235, Financial Economics: ""Selloffs, Bailouts, and Feedback: Can Asset Prices Inform Policy?"" Joint with Haas Finance",Seminar: Financial Economics,2014-03-06T11:00:00,2014-03-06T12:30:00,C220 Cheit Hall,"Curtis Taylor, Duke University","Department of Economics, Haas School of Business",,Economics
"Seminar 251, Labor: ""Necessary Luxuries: Evidence from India on Peer Effects in Consumption""",Seminar: Labor Economics,2014-03-06T14:00:00,2014-03-06T15:30:00,648 Evans Hall,"Krishna Pendakur, Simon Fraser University",Center For Labor Economics,Joint with Arthur Lewbel and Sam Norris,Economics
"Seminar 242, Econometrics: ""Unobserved Heterogeneity in Matching Games: Biotech Venture Capital""",Seminar: Econometrics,2014-03-06T16:00:00,2014-03-06T17:30:00,648 Evans Hall,"Jeremy Fox, Michigan",Department of Economics,Joint wit IO seminar. Co-authored with David Hsu and Chenyu Yang,Economics
"Seminar 221, Industrial Organization: ""Unobserved Heterogeneity in Matching Games: Biotech Venture Capital"" (w/ Chenyu Yang)",Seminar: Industrial Organization,2014-03-06T16:00:00,2014-03-06T17:30:00,648 Evans Hall,"Jeremy Fox, University of Michigan",Department of Economics,Joint with Econometrics Seminar *Please note change in time/location seminar due to joint event.,Economics
"Labor Lunch: ""Winning versus Losing: How Important are Reservation Wages for Unemployment Duration?""",Seminar: Labor Lunch Seminar,2014-03-07T12:00:00,2014-03-07T13:00:00,648 Evans Hall,"Kathrin Degen, University of Lausanne",Center For Labor Economics,,Economics
Seminar 231: PF Lunch Seminar -,Seminar: Public Finance,2014-03-10T12:00:00,2014-03-10T14:00:00,639 Evans Hall,Robert D. Burch Center for Tax Policy and Public Finance,,RSVP required,Economics
"Seminar 271, Development: ""Tax Farming Redux: Experimental Evidence on Incentive Pay for Tax Collectors""",Seminar: Development and Planning,2014-03-10T16:00:00,2014-03-10T17:30:00,648 Evans Hall,"Ben Olken, MIT","Department of Economics, CEGA - Center for Effective Global Action",,Economics
"Seminar 208, Microeconomic Theory: ""Optimal Design for Social Learning""",Seminar: Microeconomic Theory,2014-03-10T16:00:00,2014-03-10T17:30:00,639 Evans Hall,"Yeon-Koo Che, Columbia",Department of Economics,Co-authored with Johannes Horner (Yale),Economics
Development Lunch: To be announced,Seminar: Development Lunch,2014-03-11T12:30:00,2014-03-11T13:30:00,648 Evans Hall,Pierre Bachas,"Department of Economics, Center for Effective Global Action -- CEGA",,Economics
"Seminar 218, Psych and Econ: ""Worrying about the Stock Market: Evidence from Hospital Admissions""",Seminar: Psychology and Economics,2014-03-11T14:00:00,2014-03-11T15:30:00,648 Evans Hall,"Joey Engelberg, University of California, San Diego",Department of Economics,Host: Stefano DellaVigna,Economics
"Seminar 221, Industrial Organization: ""Empirical Analysis of Systemic Risk in the EURO Zone"" (w/ Pietro Bonaldi and Ali Hortacsu)",Seminar: Industrial Organization,2014-03-11T16:00:00,2014-03-11T17:30:00,597 Evans Hall,"Jakub Kastl, Stanford University",Department of Economics,,Economics
"Seminar 242, Econometrics: ""Evaluation of Some Inference-Based Statistical Treatment Rules""",Seminar: Econometrics,2014-03-11T16:00:00,2014-03-11T18:00:00,648 Evans Hall,"Chuck Manski, Northwestern",Department of Economics,Please note the time change.,Economics
Berkeley Innovation Seminar: Agglomeration and Knowledge in Invention: A New Approach and Evidence from US Patents 1836-2010,Seminar,2014-03-12T12:00:00,2014-03-12T13:30:00,"Blum Hall, Room 330","Mikko Packalen, Waterloo; Jay Bhattacharya, Stanford",Department of Economics,,Economics
"Seminar 291, Departmental: ""Was Stalin Necessary for Russias Economic Development?""",Seminar: Departmental Seminar,2014-03-12T16:00:00,2014-03-12T17:30:00,648 Evans Hall,"Sergei Guriev, New Economic School",Department of Economics,Host: Stefano DellaVigna,Economics
"Seminar 235, Financial Economics: ""TBA"" Joint with Haas Finance",Seminar: Financial Economics,2014-03-13T11:00:00,2014-03-13T12:30:00,C220 Cheit Hall,"David Easley, Cornell University","Department of Economics, Haas School of Business",,Economics
"Seminar 251, Labor: ""Field of study, earnings, and self-selection""",Seminar: Labor Economics,2014-03-13T14:00:00,2014-03-13T15:30:00,648 Evans Hall,"Magne Mogstad, University of Chicago",Center For Labor Economics,,Economics
"Labor Lunch: ""Multigenerational effects of the 1918-19 influenza pandemic in Sweden""",Seminar: Labor Lunch Seminar,2014-03-14T12:00:00,2014-03-14T13:00:00,648 Evans Hall,"Per Olaf Robling, Stockholm University",Center For Labor Economics,,Economics
Seminar 231: PF Lunch Seminar -,Seminar: Public Finance,2014-03-17T12:00:00,2014-03-17T14:00:00,639 Evans Hall,Robert D. Burch Center for Tax Policy and Public Finance,,RSVP required,Economics
Political Economy Research Lunch,Seminar: Political Economy,2014-03-17T12:30:00,2014-03-17T14:00:00,223 Moses Hall,"Carlos Avenancio, UC Berkeley Haas School of Business",Berkeley Center for Political Economy,,Economics
"Seminar 271, Development: ""Topic Forthcoming""",Seminar: Development and Planning,2014-03-17T16:00:00,2014-03-17T17:30:00,648 Evans Hall,"Paul Gertler, UC Berkeley","Department of Economics, CEGA - Center for Effective Global Action",,Economics
"Seminar 217, Risk Management: ""Information Theory and Finance: Cover's Universal Portfolios""",Seminar: Risk Management,2014-03-18T10:00:00,2014-03-18T11:30:00,639 Evans Hall,Nicholas Gunther,Department of Economics,,Economics
Development Lunch: To be announced,Seminar: Development Lunch,2014-03-18T12:30:00,2014-03-18T13:30:00,648 Evans Hall,Tadeja Gracner,"Department of Economics, Center for Effective Global Action -- CEGA",,Economics
"Seminar 237, Macro: ""Trilemma Stability and International Macroeconomic Archetypes""",Seminar: Macroeconomics,2014-03-18T14:00:00,2014-03-18T15:30:00,597 Evans Hall,"Helen Popper, Santa Clara University","Department of Economics, Clausen Center for International Business & Policy",,Economics
"Seminar 218, Psych and Econ: ""Stochastic Reference Points, Loss Aversion and Choice under Risk""",Seminar: Psychology and Economics,2014-03-18T14:00:00,2014-03-18T15:30:00,648 Evans Hall,"Collin Raymond, University of Oxford",Department of Economics,Host: Stefano DellaVigna,Economics
"Seminar 281, International: ""Trilemma Stability and International Macroeconomic Archetypes""",Seminar: International Trade & Finance,2014-03-18T14:00:00,2014-03-18T15:30:00,597 Evans Hall,"Helen Popper, Santa Clara University","Department of Economics, Clausen Center for International Business & Policy",,Economics
"Seminar 221, Industrial Organization: ""Topic Forthcoming""",Seminar: Industrial Organization,2014-03-18T16:00:00,2014-03-18T17:30:00,597 Evans Hall,"Connan Snider, UCLA",Department of Economics,,Economics
Berkeley Innovation Seminar,Seminar,2014-03-19T12:05:00,2014-03-19T13:30:00,330 Blum Hall,"Jeffrey Furman, Boston University",Department of Economics,,Economics
"Seminar 291, Departmental: No Seminar",Seminar: Departmental Seminar,2014-03-19T16:00:00,2014-03-19T17:30:00,648 Evans Hall,Department of Economics,Stefano DellaVigna,,Economics
"Seminar 251, Labor: Topic Forthcoming",Seminar: Labor Economics,2014-03-20T14:00:00,2014-03-20T15:30:00,648 Evans Hall,"Nirav Mehta, University of Western Ontario",Center For Labor Economics,,Economics
"Seminar 242, Econometrics: ""Reading Group""",Seminar: Econometrics,2014-03-20T16:00:00,2014-03-20T17:30:00,648 Evans Hall,"Ying Zhu, UC Berkeley",Department of Economics,,Economics
"Labor Lunch:""What Do China's Government-run Unions Do?""",Seminar: Labor Lunch Seminar,2014-03-21T12:00:00,2014-03-21T13:00:00,648 Evans Hall,"Richard Freeman, Havard University",Center For Labor Economics,Joint with Fan Liang,Economics
"Seminar 271, Development: ""No Seminar""",Seminar: Development and Planning,2014-03-24T16:00:00,2014-03-24T17:30:00,648 Evans Hall,"Department of Economics, CEGA - Center for Effective Global Action",,,Economics
"Seminar 251, Labor: No Meeting",Seminar: Labor Economics,2014-03-27T14:00:00,2014-03-27T15:30:00,648 Evans Hall,No meeting,Center For Labor Economics,,Economics
Labor Lunch: No Meeting - Spring Break,Seminar: Labor Lunch Seminar,2014-03-28T12:00:00,2014-03-28T13:00:00,648 Evans Hall,Center For Labor Economics,,,Economics
"Seminar 231, Public Finance: ""Harnessing Naturally-Occurring Data to Measure Income and Spending Accurately in Real Time""",Seminar: Public Finance,2014-03-31T14:00:00,2014-03-31T15:30:00,639 Evans Hall,"Dan Silverman, Arizona State University",Robert D. Burch Center for Tax Policy and Public Finance,,Economics
"Seminar 271, Development: ""Topic Forthcoming""",Seminar: Development and Planning,2014-03-31T16:00:00,2014-03-31T17:30:00,648 Evans Hall,"Gerard Padro i Miquel, London School of Economics","Department of Economics, CEGA - Center for Effective Global Action",,Economics
"Seminar 208, Microeconomic Theory: ""Topic Forthcoming""",Seminar: Microeconomic Theory,2014-03-31T16:00:00,2014-03-31T17:30:00,639 Evans Hall,"Christopher Chambers, UCSD",Department of Economics,,Economics
"Seminar 217, Risk Management: ""Asymptotically Optimal Importance Sampling for Default Timing""",Seminar: Risk Management,2014-04-01T10:00:00,2014-04-01T11:30:00,639 Evans Hall,Alex Shkolnik,Department of Economics,,Economics
Development Lunch: Seasonal credit constraints and agricultural labor supply: Evidence from Zambia,Seminar: Development Lunch,2014-04-01T12:30:00,2014-04-01T13:30:00,648 Evans Hall,Kelsey Jack,"Department of Economics, Center for Effective Global Action -- CEGA",,Economics
"Seminar 281, International: ""Sign Restrictions, Structural Vector Autoregressions, and Useful Prior Information""",Seminar: International Trade & Finance,2014-04-01T14:00:00,2014-04-01T15:30:00,597 Evans Hall,"James Hamilton, UC San Diego","Department of Economics, Clausen Center for International Business & Policy",,Economics
"Seminar 237, Macro: ""Sign Restrictions, Structural Vector Autoregressions, and Useful Prior Information""",Seminar: Macroeconomics,2014-04-01T14:00:00,2014-04-01T15:30:00,597 Evans Hall,"James Hamilton, UC San Diego","Department of Economics, Clausen Center for International Business & Policy",,Economics
"Seminar 218, Psych and Econ: TBA",Seminar: Psychology and Economics,2014-04-01T14:00:00,2014-04-01T15:30:00,648 Evans Hall,Department of Economics,Stefano DellaVigna,,Economics
"Seminar 242, Econometrics: ""Topic Forthcoming""",Seminar: Econometrics,2014-04-01T14:00:00,2014-04-01T16:00:00,597 Evans Hall,"James Hamilton, UCSD",Department of Economics,Joint with Macro,Economics
"Seminar 221, Industrial Organization: ""Topic Forthcoming""",Seminar: Industrial Organization,2014-04-01T16:00:00,2014-04-01T17:30:00,597 Evans Hall,"Kei Kawai, NYU Stern",Department of Economics,,Economics
Berkeley Innovation Seminar,Seminar,2014-04-02T12:05:00,2014-04-02T13:30:00,330 Blum Hall,"Mark Schankerman, London School of Economics",Department of Economics,,Economics
"Seminar 291, Departmental: No Seminar",Seminar: Departmental Seminar,2014-04-02T16:00:00,2014-04-02T17:30:00,648 Evans Hall,Department of Economics,Stefano DellaVigna,,Economics
"Seminar 251, Labor: ""Quasi-Experimental Evidence of School Choice through Residential Sorting""",Seminar: Labor Economics,2014-04-03T14:00:00,2014-04-03T15:30:00,648 Evans Hall,"Hugh Macartney, Duke University",Center For Labor Economics,,Economics
Labor Lunch: Topic Forthcoming,Seminar: Labor Lunch Seminar,2014-04-04T12:00:00,2014-04-04T13:00:00,648 Evans Hall,"Nathanael Vellekoop, Goethe University Frankfurt",Center For Labor Economics,,Economics
Political Economy Research Lunch,Seminar: Political Economy,2014-04-07T12:30:00,2014-04-07T14:00:00,223 Moses Hall,"Johannes Buggle, UC Berkeley Economics Department",Berkeley Center for Political Economy,,Economics
"Seminar 231, Public Finance: ""The Future of the Corporate Tax""",Seminar: Public Finance,2014-04-07T14:00:00,2014-04-07T15:30:00,639 Evans Hall,"Kim Clausing, Reed College",Robert D. Burch Center for Tax Policy and Public Finance,,Economics
Economics 211: Berkeley Economic History Laboratory (BEHL) Weekly Seminar: Scientific Knowledge and Industrialization,Seminar: Economic History,2014-04-07T14:00:00,2014-04-07T16:00:00,597 Evans Hall,"Nico Voigtlander, Assistant Professor, UC Los Angeles, Anderson School of Management",Department of Economics,,Economics
"Seminar 271, Development: ""Topic Forthcoming""",Seminar: Development and Planning,2014-04-07T16:00:00,2014-04-07T17:30:00,648 Evans Hall,"James Fenske, Oxford University","Department of Economics, CEGA - Center for Effective Global Action",,Economics
"Seminar 208, Microeconomic Theory: ""Topic Forthcoming""",Seminar: Microeconomic Theory,2014-04-07T16:00:00,2014-04-07T17:30:00,639 Evans Hall,"Juuso Toikka, MIT",Department of Economics,,Economics
"Seminar 217, Risk Management: ""Large dimensional factor analysis based on high-frequency observations""",Seminar: Risk Management,2014-04-08T10:00:00,2014-04-08T11:30:00,639 Evans Hall,Markus Pelger,Department of Economics,,Economics
Development Lunch: Market power and firm-growth. Evidence from Colombia,Seminar: Development Lunch,2014-04-08T12:30:00,2014-04-08T13:30:00,648 Evans Hall,Simon Galle,"Department of Economics, Center for Effective Global Action -- CEGA",,Economics
"Seminar 281, International: ""Topic Forthcoming""",Seminar: International Trade & Finance,2014-04-08T14:00:00,2014-04-08T15:30:00,597 Evans Hall,"David Weinstein, Columbia","Department of Economics, Clausen Center for International Business & Policy",,Economics
"Seminar 237, Macro: ""Topic Forthcoming""",Seminar: Macroeconomics,2014-04-08T14:00:00,2014-04-08T15:30:00,597 Evans Hall,"David Weinstein, Columbia","Department of Economics, Clausen Center for International Business & Policy",,Economics
